{
  "x-osdu-review-status": "Pending",
  "$id": "https://schema.osdu.opengroup.org/json/content/GcmsAlkanesDataSchema.1.0.0.json",
  "$schema": "http://json-schema.org/draft-07/schema#",
  "title": "GcmsAlkanesDataSchema",
  "description": "GcmsAlkanesDataSchema",
  "type": "object",
  "properties": {
    "SamplesAnalysisID": {
      "type": "string",
      "pattern": "^[\\w\\-\\.]+:work-product-component\\-\\-SamplesAnalysis:[\\w\\-\\.\\:\\%]+:[0-9]*$",
      "x-osdu-relationship": [
        {
          "EntityType": "SamplesAnalysis",
          "GroupType": "work-product-component"
        }
      ]
    },
    "SampleID": {
      "type": "string",
      "pattern": "^[\\w\\-\\.]+:master-data\\-\\-Sample:[\\w\\-\\.\\:\\%]+:[0-9]*$",
      "x-osdu-relationship": [
        {
          "EntityType": "Sample",
          "GroupType": "master-data"
        }
      ]
    },
    "Method": {
      "type": "string",
      "description": "The sample analysis method used for this analysis",
      "pattern": "^[\\w\\-\\.]+:reference-data\\-\\-BulkPyrolysisMethod:[\\w\\-\\.\\:\\%]+:[0-9]*$",
      "x-osdu-relationship": [
        {
          "EntityType": "BulkPyrolysisMethod",
          "GroupType": "reference-data"
        }
      ]
    },
    "SaturateGCMSCompounds": {
      "title": "Saturate Compounds",
      "description": "The list of compounds in Saturate Gas Chromatography Mass Spectrometry (GCMS) analysis",
      "type": "array",
      "items": {
        "type": "object",
        "properties": {
          "CompoundCode": {
            "type": "string",
            "pattern": "^[\\w\\-\\.]+:reference-data\\-\\-SaturateGCMSCompounds:[\\w\\-\\.\\:\\%]+:[0-9]*$",
            "x-osdu-relationship": [
              {
                "EntityType": "SaturateGCMSCompounds",
                "GroupType": "reference-data"
              }
            ]
          },
          "RetentionTime": {
            "type": "object",
            "properties": {
              "Value": {
                "type": "number"
              },
              "UnitOfMeasure": {
                "type": "string",
                "pattern": "^[\\w\\-\\.]+:reference-data\\-\\-UnitOfMeasure:[\\w\\-\\.\\:\\%]+:[0-9]*$",
                "x-osdu-relationship": [
                  {
                    "EntityType": "UnitOfMeasure",
                    "GroupType": "reference-data"
                  }
                ]
              }
            },
            "additionalProperties": false
          },
          "Ion": {
            "type": "string"
          },
          "Peak": {
            "type": "array",
            "items": {
              "type": "object",
              "properties": {
                "Value": {
                  "type": "number"
                },
                "UnitOfMeasure": {
                  "type": "string",
                  "pattern": "^[\\w\\-\\.]+:reference-data\\-\\-UnitOfMeasure:[\\w\\-\\.\\:\\%]+:[0-9]*$",
                  "x-osdu-relationship": [
                    {
                      "EntityType": "UnitOfMeasure",
                      "GroupType": "reference-data"
                    }
                  ]
                },
                "AreaHeightQualifier": {
                  "type": "string",
                  "pattern": "^[\\w\\-\\.]+:reference-data\\-\\-CompoundsAreaHeight:[\\w\\-\\.\\:\\%]+:[0-9]*$",
                  "x-osdu-relationship": [
                    {
                      "EntityType": "CompoundsAreaHeight",
                      "GroupType": "reference-data"
                    }
                  ]
                }
              },
              "additionalProperties": false
            }
          }
        },
        "additionalProperties": false
      }
    },
    "StdCompound": {
      "description": "Compound added as internal standard",
      "type": "object",
      "properties": {
        "CompoundCode": {
          "type": "string",
          "pattern": "^[\\w\\-\\.]+:reference-data\\-\\-SaturateGCMSCompounds:[\\w\\-\\.\\:\\%]+:[0-9]*$",
          "x-osdu-relationship": [
            {
              "EntityType": "SaturateGCMSCompounds",
              "GroupType": "reference-data"
            }
          ]
        },
        "RetentionTime": {
          "type": "object",
          "properties": {
            "Value": {
              "type": "number"
            },
            "UnitOfMeasure": {
              "type": "string",
              "pattern": "^[\\w\\-\\.]+:reference-data\\-\\-UnitOfMeasure:[\\w\\-\\.\\:\\%]+:[0-9]*$",
              "x-osdu-relationship": [
                {
                  "EntityType": "UnitOfMeasure",
                  "GroupType": "reference-data"
                }
              ]
            }
          },
          "additionalProperties": false
        },
        "Ion": {
          "type": "string"
        },
        "Peak": {
          "type": "array",
          "items": {
            "type": "object",
            "properties": {
              "Value": {
                "type": "number"
              },
              "UnitOfMeasure": {
                "type": "string",
                "pattern": "^[\\w\\-\\.]+:reference-data\\-\\-UnitOfMeasure:[\\w\\-\\.\\:\\%]+:[0-9]*$",
                "x-osdu-relationship": [
                  {
                    "EntityType": "UnitOfMeasure",
                    "GroupType": "reference-data"
                  }
                ]
              },
              "AreaHeightQualifier": {
                "type": "string",
                "pattern": "^[\\w\\-\\.]+:reference-data\\-\\-CompoundsAreaHeight:[\\w\\-\\.\\:\\%]+:[0-9]*$",
                "x-osdu-relationship": [
                  {
                    "EntityType": "CompoundsAreaHeight",
                    "GroupType": "reference-data"
                  }
                ]
              }
            },
            "additionalProperties": false
          }
        }
      },
      "additionalProperties": false
    }
  },
  "required": [
    "SamplesAnalysisID",
    "SampleID"
  ],
  "additionalProperties": false
}
